<?xml version='1.0' encoding='utf-8'?>
<cms:CuemsSettings xmlns:cms="https://stagelab.coop/cuems/" xmlns:xsi="http://www.w3.org/2001/XMLSchema-instance" doc_version="2" xsi:schemaLocation="https://stagelab.coop/cuems/ ../cuems/settings.xsd">
    <Settings>
        <conf_path>/etc/cuems</conf_path>
        <library_path>/opt/cuems_library</library_path>
        <tmp_path>/tmp/cuems</tmp_path>
        <database_name>project-manager.db</database_name>
        <show_lock_file>show.lock</show_lock_file>
        <editor_url>formitgo.local</editor_url>
        <controller_url>controller.local</controller_url>
        <templates_path>/usr/share/cuems</templates_path>
        <controller_interfaces_template>interfaces.controller</controller_interfaces_template>
        <node_interfaces_template>interfaces.node</node_interfaces_template>
        <controller_lock_file>controller.lock</controller_lock_file>
        <node>
            <uuid>0367f391-ebf4-48b2-9f26-000000000001</uuid>
            <mac>2cf05d21cca3</mac>
            <osc_dest_host>localhost</osc_dest_host>
            <oscquery_ws_port>9190</oscquery_ws_port>
            <oscquery_osc_port>9191</oscquery_osc_port>
            <websocket_port>9092</websocket_port>
            <load_timeout>15000</load_timeout>
            <nodeconf_timeout>5000</nodeconf_timeout>
            <discovery_timeout>15000</discovery_timeout>
            <mtc_port>Midi Through Port-0</mtc_port>
            <osc_in_port_base>7000</osc_in_port_base>
            <nng_hub_port>5555</nng_hub_port>
            <gradient_osc_port>7100</gradient_osc_port>
            <players><player class="video"><path>/usr/bin/videocomposer</path>
                <args />
                <outputs>2</outputs>
                
                <output_latency_ms>auto</output_latency_ms>
            </player><player class="audio"><path>/usr/bin/cuems-audioplayer</path>
                <args>-w -1</args>
                
                <output_latency_ms>auto</output_latency_ms>
            </player><player class="dmx"><path>/usr/bin/cuems-dmxplayer</path>
                <args />
                
                <output_latency_ms>35</output_latency_ms>
            </player></players></node>
    </Settings>
</cms:CuemsSettings>